[
  {
    "is_synthetic": true,
    "id": "CUS-001",
    "name": "演示客户-DE-01",
    "type": "owner",
    "country_code": "DE",
    "preferred_language": "de",
    "contact_name": "演示联系人-001",
    "email": "customer-001@example.invalid",
    "phone": null,
    "preferred_contact": "email",
    "consent_to_service_contact": true,
    "tenant_id": "TENANT-001"
  },
  {
    "is_synthetic": true,
    "id": "CUS-002",
    "name": "演示客户-DE-02",
    "type": "installer",
    "country_code": "DE",
    "preferred_language": "de",
    "contact_name": "演示联系人-002",
    "email": "customer-002@example.invalid",
    "phone": null,
    "preferred_contact": "email",
    "consent_to_service_contact": true,
    "tenant_id": "TENANT-002"
  },
  {
    "is_synthetic": true,
    "id": "CUS-003",
    "name": "演示客户-DE-03",
    "type": "distributor",
    "country_code": "DE",
    "preferred_language": "de",
    "contact_name": "演示联系人-003",
    "email": "customer-003@example.invalid",
    "phone": null,
    "preferred_contact": "email",
    "consent_to_service_contact": true,
    "tenant_id": "TENANT-003"
  },
  {
    "is_synthetic": true,
    "id": "CUS-004",
    "name": "演示客户-DE-04",
    "type": "project_operator",
    "country_code": "DE",
    "preferred_language": "de",
    "contact_name": "演示联系人-004",
    "email": "customer-004@example.invalid",
    "phone": null,
    "preferred_contact": "email",
    "consent_to_service_contact": true,
    "tenant_id": "TENANT-004"
  },
  {
    "is_synthetic": true,
    "id": "CUS-005",
    "name": "演示客户-DE-05",
    "type": "owner",
    "country_code": "DE",
    "preferred_language": "de",
    "contact_name": "演示联系人-005",
    "email": "customer-005@example.invalid",
    "phone": null,
    "preferred_contact": "email",
    "consent_to_service_contact": true,
    "tenant_id": "TENANT-005"
  },
  {
    "is_synthetic": true,
    "id": "CUS-006",
    "name": "演示客户-DE-06",
    "type": "installer",
    "country_code": "DE",
    "preferred_language": "de",
    "contact_name": "演示联系人-006",
    "email": "customer-006@example.invalid",
    "phone": null,
    "preferred_contact": "email",
    "consent_to_service_contact": true,
    "tenant_id": "TENANT-006"
  },
  {
    "is_synthetic": true,
    "id": "CUS-007",
    "name": "演示客户-DE-07",
    "type": "distributor",
    "country_code": "DE",
    "preferred_language": "de",
    "contact_name": "演示联系人-007",
    "email": "customer-007@example.invalid",
    "phone": null,
    "preferred_contact": "email",
    "consent_to_service_contact": true,
    "tenant_id": "TENANT-007"
  },
  {
    "is_synthetic": true,
    "id": "CUS-008",
    "name": "演示客户-DE-08",
    "type": "project_operator",
    "country_code": "DE",
    "preferred_language": "de",
    "contact_name": "演示联系人-008",
    "email": "customer-008@example.invalid",
    "phone": null,
    "preferred_contact": "email",
    "consent_to_service_contact": true,
    "tenant_id": "TENANT-008"
  },
  {
    "is_synthetic": true,
    "id": "CUS-009",
    "name": "演示客户-DE-09",
    "type": "owner",
    "country_code": "DE",
    "preferred_language": "de",
    "contact_name": "演示联系人-009",
    "email": "customer-009@example.invalid",
    "phone": null,
    "preferred_contact": "email",
    "consent_to_service_contact": true,
    "tenant_id": "TENANT-009"
  },
  {
    "is_synthetic": true,
    "id": "CUS-010",
    "name": "演示客户-DE-10",
    "type": "installer",
    "country_code": "DE",
    "preferred_language": "de",
    "contact_name": "演示联系人-010",
    "email": "customer-010@example.invalid",
    "phone": null,
    "preferred_contact": "email",
    "consent_to_service_contact": true,
    "tenant_id": "TENANT-010"
  },
  {
    "is_synthetic": true,
    "id": "CUS-011",
    "name": "演示客户-DE-11",
    "type": "distributor",
    "country_code": "DE",
    "preferred_language": "de",
    "contact_name": "演示联系人-011",
    "email": "customer-011@example.invalid",
    "phone": null,
    "preferred_contact": "email",
    "consent_to_service_contact": true,
    "tenant_id": "TENANT-011"
  },
  {
    "is_synthetic": true,
    "id": "CUS-012",
    "name": "演示客户-DE-12",
    "type": "project_operator",
    "country_code": "DE",
    "preferred_language": "de",
    "contact_name": "演示联系人-012",
    "email": "customer-012@example.invalid",
    "phone": null,
    "preferred_contact": "email",
    "consent_to_service_contact": true,
    "tenant_id": "TENANT-012"
  },
  {
    "is_synthetic": true,
    "id": "CUS-013",
    "name": "演示客户-NL-01",
    "type": "owner",
    "country_code": "NL",
    "preferred_language": "nl",
    "contact_name": "演示联系人-013",
    "email": "customer-013@example.invalid",
    "phone": null,
    "preferred_contact": "email",
    "consent_to_service_contact": true,
    "tenant_id": "TENANT-013"
  },
  {
    "is_synthetic": true,
    "id": "CUS-014",
    "name": "演示客户-NL-02",
    "type": "installer",
    "country_code": "NL",
    "preferred_language": "nl",
    "contact_name": "演示联系人-014",
    "email": "customer-014@example.invalid",
    "phone": null,
    "preferred_contact": "email",
    "consent_to_service_contact": true,
    "tenant_id": "TENANT-014"
  },
  {
    "is_synthetic": true,
    "id": "CUS-015",
    "name": "演示客户-NL-03",
    "type": "distributor",
    "country_code": "NL",
    "preferred_language": "nl",
    "contact_name": "演示联系人-015",
    "email": "customer-015@example.invalid",
    "phone": null,
    "preferred_contact": "email",
    "consent_to_service_contact": true,
    "tenant_id": "TENANT-015"
  },
  {
    "is_synthetic": true,
    "id": "CUS-016",
    "name": "演示客户-NL-04",
    "type": "project_operator",
    "country_code": "NL",
    "preferred_language": "nl",
    "contact_name": "演示联系人-016",
    "email": "customer-016@example.invalid",
    "phone": null,
    "preferred_contact": "email",
    "consent_to_service_contact": true,
    "tenant_id": "TENANT-016"
  },
  {
    "is_synthetic": true,
    "id": "CUS-017",
    "name": "演示客户-NL-05",
    "type": "owner",
    "country_code": "NL",
    "preferred_language": "nl",
    "contact_name": "演示联系人-017",
    "email": "customer-017@example.invalid",
    "phone": null,
    "preferred_contact": "email",
    "consent_to_service_contact": true,
    "tenant_id": "TENANT-017"
  },
  {
    "is_synthetic": true,
    "id": "CUS-018",
    "name": "演示客户-NL-06",
    "type": "installer",
    "country_code": "NL",
    "preferred_language": "nl",
    "contact_name": "演示联系人-018",
    "email": "customer-018@example.invalid",
    "phone": null,
    "preferred_contact": "email",
    "consent_to_service_contact": true,
    "tenant_id": "TENANT-018"
  },
  {
    "is_synthetic": true,
    "id": "CUS-019",
    "name": "演示客户-NL-07",
    "type": "distributor",
    "country_code": "NL",
    "preferred_language": "nl",
    "contact_name": "演示联系人-019",
    "email": "customer-019@example.invalid",
    "phone": null,
    "preferred_contact": "email",
    "consent_to_service_contact": true,
    "tenant_id": "TENANT-019"
  },
  {
    "is_synthetic": true,
    "id": "CUS-020",
    "name": "演示客户-NL-08",
    "type": "project_operator",
    "country_code": "NL",
    "preferred_language": "nl",
    "contact_name": "演示联系人-020",
    "email": "customer-020@example.invalid",
    "phone": null,
    "preferred_contact": "email",
    "consent_to_service_contact": true,
    "tenant_id": "TENANT-020"
  },
  {
    "is_synthetic": true,
    "id": "CUS-021",
    "name": "演示客户-NL-09",
    "type": "owner",
    "country_code": "NL",
    "preferred_language": "nl",
    "contact_name": "演示联系人-021",
    "email": "customer-021@example.invalid",
    "phone": null,
    "preferred_contact": "email",
    "consent_to_service_contact": true,
    "tenant_id": "TENANT-021"
  },
  {
    "is_synthetic": true,
    "id": "CUS-022",
    "name": "演示客户-NL-10",
    "type": "installer",
    "country_code": "NL",
    "preferred_language": "nl",
    "contact_name": "演示联系人-022",
    "email": "customer-022@example.invalid",
    "phone": null,
    "preferred_contact": "email",
    "consent_to_service_contact": true,
    "tenant_id": "TENANT-022"
  },
  {
    "is_synthetic": true,
    "id": "CUS-023",
    "name": "演示客户-NL-11",
    "type": "distributor",
    "country_code": "NL",
    "preferred_language": "nl",
    "contact_name": "演示联系人-023",
    "email": "customer-023@example.invalid",
    "phone": null,
    "preferred_contact": "email",
    "consent_to_service_contact": true,
    "tenant_id": "TENANT-023"
  },
  {
    "is_synthetic": true,
    "id": "CUS-024",
    "name": "演示客户-NL-12",
    "type": "project_operator",
    "country_code": "NL",
    "preferred_language": "nl",
    "contact_name": "演示联系人-024",
    "email": "customer-024@example.invalid",
    "phone": null,
    "preferred_contact": "email",
    "consent_to_service_contact": true,
    "tenant_id": "TENANT-024"
  },
  {
    "is_synthetic": true,
    "id": "CUS-025",
    "name": "演示客户-ES-01",
    "type": "owner",
    "country_code": "ES",
    "preferred_language": "es",
    "contact_name": "演示联系人-025",
    "email": "customer-025@example.invalid",
    "phone": null,
    "preferred_contact": "email",
    "consent_to_service_contact": true,
    "tenant_id": "TENANT-025"
  },
  {
    "is_synthetic": true,
    "id": "CUS-026",
    "name": "演示客户-ES-02",
    "type": "installer",
    "country_code": "ES",
    "preferred_language": "es",
    "contact_name": "演示联系人-026",
    "email": "customer-026@example.invalid",
    "phone": null,
    "preferred_contact": "email",
    "consent_to_service_contact": true,
    "tenant_id": "TENANT-026"
  },
  {
    "is_synthetic": true,
    "id": "CUS-027",
    "name": "演示客户-ES-03",
    "type": "distributor",
    "country_code": "ES",
    "preferred_language": "es",
    "contact_name": "演示联系人-027",
    "email": "customer-027@example.invalid",
    "phone": null,
    "preferred_contact": "email",
    "consent_to_service_contact": true,
    "tenant_id": "TENANT-027"
  },
  {
    "is_synthetic": true,
    "id": "CUS-028",
    "name": "演示客户-ES-04",